NAME,AIaaS Stack Level,Category,Industry,Sub-Category,Description,URL,Source(s),,,,,,
Cinchy,Infrastructure,Infrastructure,N/A,ETL / ELT / Data Transformation,"Cinchy is the world's first comprehensive dataware platform that unlocks 
data from enterprise apps and connects it in a universal data network",https://cinchy.com,Firstmark,,,,,,
Enso,Infrastructure,Infrastructure,N/A,ETL / ELT / Data Transformation,Get insights you can rely on. In real time. Turning your data into knowledge is slow and error-prone. You can’t trust tools that don’t embrace best practices and provide quality assurance.,https://enso.org/,Firstmark,,,,,,
Fivetran,Infrastructure,Infrastructure,N/A,ETL / ELT / Data Transformation,"Effortlessly centralize all the data you need so your team can deliver 
better insights, faster. Start for free.",https://fivetran.com/,Firstmark,,,,,,
Meltano,Infrastructure,Infrastructure,N/A,ETL / ELT / Data Transformation,"Meltano lets you move, transform and test your data with confidence using a 
streamlined data engineering workflow you’ll love.",https://meltano.com/,Firstmark,,,,,,
StreamSets,Infrastructure,Infrastructure,N/A,ETL / ELT / Data Transformation,"StreamSets data integration platform is a single interface for creating, 
reusing and sharing data pipelines to unlock your data without ceding 
control.",https://streamsets.com/,Firstmark,,,,,,
dbt Labs,Infrastructure,Infrastructure,N/A,ETL / ELT / Data Transformation,"dbt is a data transformation tool that enables data analysts and engineers 
to transform, test and document data in the cloud data warehouse.",https://www.getdbt.com/,Firstmark,,,,,,
Keboola,Infrastructure,Infrastructure,N/A,ETL / ELT / Data Transformation,"A dataops platform built to set up data practitioners for success. Sign up 
today and create a free account!",https://www.keboola.com/,Firstmark,,,,,,
Matillion,Infrastructure,Infrastructure,N/A,ETL / ELT / Data Transformation,"Matillion helps teams get data business-ready, faster. Thousands of 
enterprises trust us to load, transform, sync, and orchestrate their data 
in the cloud.",https://www.matillion.com/,Firstmark,,,,,,
Stitch Data,Infrastructure,Infrastructure,N/A,ETL / ELT / Data Transformation,"Stitch rapidly moves data from 130+ sources into a data warehouse so you 
can get to answers faster, no coding required. Analysis-ready data at your 
fingertips.",https://www.stitchdata.com/,Firstmark,,,,,,
StrikeIron,Infrastructure,Infrastructure,N/A,ETL / ELT / Data Transformation,"Informatica is a data as a service (DaaS) provider that helps companies 
confidently engage with their customers using verified and enriched data.",https://www.strikeiron.com/,Firstmark,,,,,,
Trifacta,Infrastructure,Infrastructure,N/A,ETL / ELT / Data Transformation,"Designer Cloud powered by Trifacta is the only open and interactive data 
engineering cloud platform to collaboratively profile, prepare, and 
pipeline data for analytics and machine learning.",https://www.trifacta.com/,Firstmark,,,,,,
Vendia,Infrastructure,Infrastructure,N/A,ETL / ELT / Data Transformation,Share data and code with partners in real time,https://www.vendia.net/,Firstmark,,,,,,
Google Vertex AI,Infrastructure,Infrastructure,N/A,Feature Store,"Vertex AI Feature Store provides a centralized repository for organizing, storing, and serving ML features.",https://cloud.google.com/vertex-ai/docs/featurestore/overview,FirstMark,,,,,,
Hopsworks,Infrastructure,Infrastructure,N/A,Feature Store,"Hopsworks is the best python-centric feature store with the most complete 
MLOps capabilities. Collaborate and create an effective pipeline on all of 
your AI data, and bring your models to production.",https://www.hopsworks.ai/,FirstMark,,,,,,
PG-Strom,Infrastructure,Infrastructure,N/A,GPU DBs & Cloud,"By utilization of GPU (Graphic Processor Unit) device which has thousands cores per chip, it enables to accelerate SQL workloads for data analytics or batch processing to big data set.",http://heterodb.github.io/pg-strom/,FirstMark,,,,,,
Fauna,Infrastructure,Infrastructure,N/A,GPU DBs & Cloud,Fauna combines the flexibility of NoSQL with the relational querying capabilities and ACID consistency of SQL systems — with native GraphQL and delivered as a cloud API so you don’t have to worry about operations.,http://www.fauna.com,FirstMark,,,,,,
Kinetica,Infrastructure,Infrastructure,N/A,GPU DBs & Cloud,"Kinetica is a real-time, vectorized, analytic database for time-series and 
spatial workloads",http://www.kinetica.com,FirstMark,,,,,,
SQream,Infrastructure,Infrastructure,N/A,GPU DBs & Cloud,"SQream makes it possible to ask bigger questions of extremely large, 
complicated data sets. Using a GPU-based engine, analysts get new insights 
at exceptional speed.",http://www.sqream.com,FirstMark,,,,,,
Blazegraph,Infrastructure,Infrastructure,N/A,GPU DBs & Cloud,Blazegraph™ DB is a ultra high-performance graph database supporting Blueprints and RDF/SPARQL APIs. It supports up to 50 Billion edges on a single machine.,https://www.blazegraph.com/,FirstMark,,,,,,
Brytlyt,Infrastructure,Infrastructure,N/A,GPU DBs & Cloud,"Brytlyt is the best all in one AI deep learning and data visualisation 
platform, helping you understand and utilise your data faster and more 
efficiently.",https://www.brytlyt.com,FirstMark,,,,,,
FloydHub,Infrastructure,Infrastructure,N/A,GPU DBs & Cloud,Deep Learning • Artificial Intelligence • Cloud GPUs,https://www.floydhub.com/,FirstMark,,,,,,
Paperspace,Infrastructure,Infrastructure,N/A,GPU DBs & Cloud,"Cloud Machine Learning, AI, and effortless GPU infrastructure",https://www.paperspace.com/,FirstMark,,,,,,
Giraph,Infrastructure,Infrastructure,N/A,Graph Databases,Apache Giraph is an iterative graph processing system built for high scalability.,http://giraph.apache.org/,FirstMark,,,,,,
Neo4j,Infrastructure,Infrastructure,N/A,Graph Databases,"Connect data as it's stored with Neo4j. Perform powerful, complex queries 
at scale and speed with our graph data platform.",http://neo4j.com/,FirstMark,,,,,,
GraphDB,Infrastructure,Infrastructure,N/A,Graph Databases,"A highly efficient and robust graph database with RDF and SPARQL support, 
compliant with W3C standards, that can help you build big knowledge graphs.",http://ontotext.com/products/graphdb/,FirstMark,,,,,,
Aurelius TitanDB,Infrastructure,Infrastructure,N/A,Graph Databases,Titan : Distributed Graph Database,http://titan.thinkaurelius.com/,FirstMark,,,,,,
Objectivity,Infrastructure,Infrastructure,N/A,Graph Databases,"Objectivity delivers massively scalable and high performance graph database 
and data management software products that are proven to power 
mission-critical applications for the most demanding and complex datasets.",http://www.objectivity.com/,FirstMark,,,,,,
InfiniteGraph,Infrastructure,Infrastructure,N/A,Graph Databases,"InfiniteGraph is an enterprise distributed graph database. Objectivity is 
offering InfiniteGraph for Free with up to 50GB of disk storage.",http://www.objectivity.com/products/infinitegraph/,FirstMark,,,,,,
Oracle Spatial and Graph,Infrastructure,Infrastructure,N/A,Graph Databases,"In keeping with Oracle's mission to help people see data in new ways, discover insights, unlock endless possibilities, Oracle Database now includes the Machine Learning, Spatial and Graph features. If you have an Oracle Database license, you can use all the industry-leading Machine Learning, Spatial and Graph capabilities for development and deployment purposes on premise and in Oracle Cloud Database Services.",http://www.oracle.com/technetwork/database-options/spatialandgraph/overview/spatialandgraph-1707409.html,FirstMark,,,,,,
Aster Data,Infrastructure,Infrastructure,N/A,Graph Databases,"Teradata Vantage™ is a powerful, connected modern cloud platform that 
unifies everything—data lakes, data warehouses, analytics, and new data 
sources and types.",http://www.teradata.com/Teradata-Aster/,FirstMark,,,,,,
Amazon Neptune,Infrastructure,Infrastructure,N/A,Graph Databases,"Amazon Neptune is a fast, fully managed database service powering graph use 
cases such as identity graphs, knowledge graphs, and fraud detection.",https://aws.amazon.com/neptune/,FirstMark,,,,,,
Memgraph,Infrastructure,Infrastructure,N/A,Graph Databases,"Open Source Graph Database Built For Real-Time Streaming Data, Compatible 
With Neo4j",https://memgraph.com/,FirstMark,,,,,,
TerminusDB,Infrastructure,Infrastructure,N/A,Graph Databases,"TerminusDB is an open source document graph database that turns JSON docs 
into powerful knowledge graphs to build data intensive apps.",https://terminusdb.com/,FirstMark,,,,,,
Cambridge Semantics,Infrastructure,Infrastructure,N/A,Graph Databases,"Cambridge Semantics provides the most scalable and complete knowledge graph 
platform designed for data integration and data fabric use cases.",https://www.cambridgesemantics.com/,FirstMark,,,,,,
IBM Graph,Infrastructure,Infrastructure,N/A,Graph Databases,"The place to shop for software, hardware and services from IBM and our 
providers. Browse by technologies, business needs and services.",https://www.ibm.com/us-en/marketplace/graph,FirstMark,,,,,,
RelationalAI,Infrastructure,Infrastructure,N/A,Graph Databases,"RelationalAI is the first relational knowledge graph system built for 
developing intelligent data apps.",https://www.relational.ai/,FirstMark,,,,,,
Stardog,Infrastructure,Infrastructure,N/A,Graph Databases,Learn how Stardog's Enterprise Knowledge Graph platform is the key to building a data fabric.,https://www.stardog.com/,FirstMark,,,,,,
TigergraphDB,Infrastructure,Infrastructure,N/A,Graph Databases,"TigerGraph is the fastest and only scalable graph database for the 
enterprise. Unleash the power and speed of our graph analytics platform 
today.",https://www.tigergraph.com/,FirstMark,,,,,,
Jethro,Infrastructure,Infrastructure,N/A,Hadoop,"We make Real-Time Business Intelligence work on Hadoop. Integrates with 
Tableau, Qlik & SaaS analytics dashboards. Dedicated support team. Free 
evaluation.",http://jethrodata.com/,FirstMark,,,,,,
Google MillWheel,Infrastructure,Infrastructure,N/A,Hadoop,MillWheel: Fault-Tolerant Stream Processing at Internet Scale,http://research.google.com/pubs/pub41378.html,FirstMark,,,,,,
IBM InfoSphere BigInsights,Infrastructure,Infrastructure,N/A,Hadoop,"The place to shop for software, hardware and services from IBM and our 
providers. Browse by technologies, business needs and services.",http://www.ibm.com/software/products/en/ibm-biginsights-on-cloud,FirstMark,,,,,,
Infochimps,Infrastructure,Infrastructure,N/A,Hadoop,"We are an enterprise big data company, assisting clients make sense of and 
utilize their big data for making productive decisions.",http://www.infochimps.com/,FirstMark,,,,,,
Treasure Data,Infrastructure,Infrastructure,N/A,Hadoop,"Capture, analyze and act on all of your customer data across every channel 
and every department. For all of your brands, all around the world.",http://www.treasure-data.com/,FirstMark,,,,,,
Amazon Elastic Map Reduce,Infrastructure,Infrastructure,N/A,Hadoop,"Amazon EMR is a cloud big data platform for running large-scale distributed 
data processing jobs, interactive SQL queries, and machine learning 
applications using open-source analytics frameworks such as Apache Spark, 
Apache Hive, and Presto.",https://aws.amazon.com/elasticmapreduce/,FirstMark,,,,,,
Microsoft Azure HDInsight,Infrastructure,Infrastructure,N/A,Hadoop,"Get HDInsight, an open-source analytics service that runs Hadoop, Spark, 
Kafka, and more. Integrate HDInsight with big data processing by Azure for 
even more insights.",https://azure.microsoft.com/en-us/services/hdinsight/,FirstMark,,,,,,
Google DataProc,Infrastructure,Infrastructure,N/A,Hadoop,"Dataproc is a fast, easy-to-use, fully managed cloud service for running 
Apache Spark and Apache Hadoop clusters in a simpler, more cost-efficient 
way",https://cloud.google.com/dataproc/,FirstMark,,,,,,
Hstreaming,Infrastructure,Infrastructure,N/A,Hadoop,"Adello is the leading AI-driven mobile ad DSP that leverages patented 
cookieless technology to deliver best-in-class brand safety & accuracy",https://www.adello.com/,FirstMark,,,,,,
CenturyLink,Infrastructure,Infrastructure,N/A,Hadoop,"From the simple to the complex, Lumen’s Advanced Managed Services brings a 
deep domain of knowledge, modern tools, expertise and operational ability 
to every project",https://www.ctl.io/managed-services/big-data/,FirstMark,,,,,,
OpenCV,Infrastructure,Infrastructure,N/A,"Hardware, Libraries (open source)","OpenCV provides a real-time optimized Computer Vision library, tools, and 
hardware. It also supports model execution for Machine Learning (ML) and 
Artificial Intelligence (AI).",https://opencv.org/,FirstMark,,,,,,"optimized Computer Vision library, tools, and hardware"
Wav2Vec,Infrastructure,Infrastructure,N/A,"Libraries (seq2seq, facebook)","Facebook AI Research Sequence-to-Sequence Toolkit written in Python. - 
fairseq/examples/wav2vec at main · facebookresearch/fairseq",github.com/pytorch/fairseq/tree/master/examples/wav2vec,CAI,,,,,,
Bokeh,Infrastructure,Infrastructure,N/A,Libraries (visualization),"Bokeh visualization library, documentation site.",https://bokeh.pydata.org/en/latest/docs/reference/models/widgets.tables.html,FirstMark,,,,,,
D3,Infrastructure,Infrastructure,N/A,Libraries (visualization),"D3 is a JavaScript library for visualizing data with HTML, SVG, and CSS.",https://d3js.org/,FirstMark,,,,,,
Facets,Infrastructure,Infrastructure,N/A,"Library (Visualization, open source)","Visualizations for machine learning datasets. Contribute to 
PAIR-code/facets development by creating an account on GitHub.",https://github.com/PAIR-code/facets,FirstMark,,,,,,
TensorBoard,Infrastructure,Infrastructure,N/A,"Library (Visualization, open source)","A suite of visualization tools to understand, debug, and optimize 
TensorFlow programs for ML experimentation.",https://www.tensorflow.org/tensorboard,FirstMark,,,,,,
Netron,Infrastructure,Infrastructure,N/A,"Library (Visualization, open source)","Netron is a viewer for neural network, deep learning and machine learning models.",https://netron.app/,FirstMark,,,,,,
Highcharts,Infrastructure,Infrastructure,N/A,Library (Visualization),"Javascript library to create interactive charts for web and mobile 
projects. Build data visualization with Angular, React, Python, R, .Net, 
PHP, Java, iOS, and Android.",https://www.highcharts.com/,FirstMark,,,,,,
Trace,Infrastructure,Infrastructure,N/A,Metrics Store,"Fast, powerful self-service analytics and operations",http://hellotrace.io,Firstmark,,,,,,
Transform Data,Infrastructure,Infrastructure,N/A,Metrics Store,"Transform Metrics Store gives orgs the ability to work on the metrics layer 
in today's modern data stack providing consistent data and metrics 
governance.",http://transformdata.io,Firstmark,,,,,,
Metriql,Infrastructure,Infrastructure,N/A,Metrics Store,Headless BI - model your data once and consume it wherever you want,https://metriql.com/,Firstmark,,,,,,
Ataccama,Infrastructure,Infrastructure,N/A,Mgmt/Monitoring,"Helping you to build an agile, data-driven organization, where data people 
have the power to drive the change.",http://ataccama.com,Firstmark,,,,,,
New Relic,Infrastructure,Infrastructure,N/A,Mgmt/Monitoring,"Sign up for free, no credit card required. Get Instant Observability with 
New Relic and Quickstarts that make it easy to instrument in a few clicks.",http://newrelic.com/,Firstmark,,,,,,
Numerify,Infrastructure,Infrastructure,N/A,Mgmt/Monitoring,"Intelligence from Digital.ai is an AI-powered enterprise-level IT analytics 
and insights product bringing transparency and data to application 
development.",http://numerify.com/,Firstmark,,,,,,
ScaleARC,Infrastructure,Infrastructure,N/A,Mgmt/Monitoring,"Database load balancing software that provides continuous availability at 
high-performance levels for mission-critical database systems deployed at 
scale.",http://scalearc.com/,Firstmark,,,,,,
AppFirst,Infrastructure,Infrastructure,N/A,Mgmt/Monitoring,"Empower your IT staff & propel your digital transformation with 
ScienceLogic's AIOps and IT infrastructure monitoring platform.",http://www.appfirst.com/,Firstmark,,,,,,
Chronosphere,Infrastructure,Infrastructure,N/A,Mgmt/Monitoring,"Chronosphere is the only observability platform that puts you back in 
control by taming rampant data growth and cloud-native complexity, 
delivering increased business confidence.",http://www.chronosphere.io,Firstmark,,,,,,
Grafana Labs,Infrastructure,Infrastructure,N/A,Mgmt/Monitoring,"Grafana is the open source analytics & monitoring solution for every 
database.",http://www.grafana.com,Firstmark,,,,,,
Magnitude Software,Infrastructure,Infrastructure,N/A,Mgmt/Monitoring,"Helping enterprises transform data into continuous intelligence and 
competitive advantage, providing actionable insights to shorten the path 
from data to decision",http://www.magnitudesoftware.com,Firstmark,,,,,,
MOOGsoft,Infrastructure,Infrastructure,N/A,Mgmt/Monitoring,"Moogsoft, an AIOps and Observability industry leader, helps ITOps & DevOps 
streamline incident resolution, prevent outages and meet SLAs.",http://www.moogsoft.com,Firstmark,,,,,,
SignalFX,Infrastructure,Infrastructure,N/A,Mgmt/Monitoring,"Splunk and SignalFx Combine Forces to Usher In New Era of APM; Joint 
Offering Helps Customers Monitor and Observe Data at Any Stage of their 
Cloud Journey",http://www.signalfx.com,Firstmark,,,,,,
Solarwinds,Infrastructure,Infrastructure,N/A,Mgmt/Monitoring,"Get simple, powerful, and secure IT management and observability software 
to help you accelerate your digital transformation. Start a free trial 
today.",http://www.solarwinds.com/,Firstmark,,,,,,
Unravel Data,Infrastructure,Infrastructure,N/A,Mgmt/Monitoring,"Unravel provides full-stack visibility and AI-powered guidance to help you 
understand and optimize the performance of your data-driven applications.",http://www.unraveldata.com,Firstmark,,,,,,
Veeam,Infrastructure,Infrastructure,N/A,Mgmt/Monitoring,Modern Data Protection,http://www.veeam.com,Firstmark,,,,,,
Amazon CloudWatch,Infrastructure,Infrastructure,N/A,Mgmt/Monitoring,"Amazon CloudWatch is a monitoring service built for DevOps engineers, 
developers, site reliability engineers (SREs), IT managers, and product 
owners.",https://aws.amazon.com/cloudwatch/,Firstmark,,,,,,
ScienceLogic,Infrastructure,Infrastructure,N/A,Mgmt/Monitoring,"Empower your IT staff & propel your digital transformation with 
ScienceLogic's AIOps and IT infrastructure monitoring platform.",https://sciencelogic.com/,Firstmark,,,,,,
AppDynamics,Infrastructure,Infrastructure,N/A,Mgmt/Monitoring,Shape the future of apps with AppDynamics cloud monitoring and Cisco Secure Application. Start your 15-day free trial today,https://www.appdynamics.com/,Firstmark,,,,,,
Datadog,Infrastructure,Infrastructure,N/A,Mgmt/Monitoring,"See inside any stack, any app, at any scale, anywhere.",https://www.datadoghq.com/,Firstmark,,,,,,
Dynatrace,Infrastructure,Infrastructure,N/A,Mgmt/Monitoring,"Innovate faster, operate more efficiently, and drive better business 
outcomes with observability, AI, automation, and application security in 
one platform.",https://www.dynatrace.com/,Firstmark,,,,,,
Honeycomb,Infrastructure,Infrastructure,N/A,Mgmt/Monitoring,"Honeycomb is a software debugging tool that can help you solve problems 
faster within your distributed services. Try Honeycomb for free today!",https://www.honeycomb.io/,Firstmark,,,,,,
ManageEngine (Zoho),Infrastructure,Infrastructure,N/A,Mgmt/Monitoring,"ManageEngine offers enterprise IT management software for your service 
management, operations management, Active Directory and security needs. 
Download free trial now.",https://www.manageengine.com/,Firstmark,,,,,,
Nagios,Infrastructure,Infrastructure,N/A,Mgmt/Monitoring,"Nagios - The Industry Standard In IT Infrastructure Monitoring. Complete 
enterprise grade network, server and log monitoring software.",https://www.nagios.com/,Firstmark,,,,,,
OpsRamp,Infrastructure,Infrastructure,N/A,Mgmt/Monitoring,"OpsRamp is an AIOps-powered IT operations management (ITOM) solution. 
OpsRamp delivers hybrid IT infrastructure, cloud monitoring services, event 
management & automation for modern digital operations management.",https://www.opsramp.com/,Firstmark,,,,,,
PagerDuty,Infrastructure,Infrastructure,N/A,Mgmt/Monitoring,"See how PagerDuty's Platform for Real-Time Operations integrates machine 
data & human intelligence to improve visibility & agility across 
organizations. Sign up for a free 14 day trial!",https://www.pagerduty.com/,Firstmark,,,,,,
Scalyr,Infrastructure,Infrastructure,N/A,Mgmt/Monitoring,"Where DataTells a StoryAny data. Any time horizon. Any scale. Unlock the 
ultimate data experience.",https://www.scalyr.com/,Firstmark,,,,,,
Zenoss,Infrastructure,Infrastructure,N/A,Mgmt/Monitoring,"Monitor your entire IT environment securely. Full-stack SaaS-based 
monitoring combined with the power of AIOps.",https://www.zenoss.com/,Firstmark,,,,,,
LightGBM,Infrastructure,Infrastructure,N/A,ML Framework (Open Source),"LightGBM is a gradient boosting framework that uses tree based learning algorithms. It is designed to be distributed and efficient with the following advantages: Faster training speed and higher efficiency. Lower memory usage. Better accuracy. Support of parallel, distributed, and GPU learning. Capable of handling large-scale data.",https://lightgbm.readthedocs.io/en/latest/,FirstMark,,,,,,
Vearch,Infrastructure,Infrastructure,N/A,ML Framework (Open Source),Vearch is the vector search infrastructure for deeping learning and AI applications.,https://vearch.github.io/,FirstMark,,,,,,
Mindspore,Infrastructure,Infrastructure,N/A,ML Framework (Open Source),"Automatic differentiation, parallel blessing, one training, can be deployed in multiple scenarios. A deep learning training and reasoning framework that supports all scenarios of the device, edge and cloud.",https://www.mindspore.cn/,FirstMark,,,,,,
PyTorch Lightning,Infrastructure,Infrastructure,N/A,ML Framework (Open Source),"The ultimate PyTorch research framework. Scale your models, without the 
boilerplate.",https://www.pytorchlightning.ai/,FirstMark,,,,,,
Anaconda,Infrastructure,Infrastructure,N/A,ML Framework (Open Source),"Anaconda's open-source Distribution is the easiest way to perform Python/R 
data science and machine learning on a single machine.",https://www.continuum.io/downloads,FirstMark,,,,,,
Accord.NET,Infrastructure,Infrastructure,N/A,ML Framework (Open Source),"Accord.NET is a .NET machine learning framework combined with audio and 
image processing libraries completely written in C# ready to be used in 
commercial applications.",http://accord-framework.net/,FirstMark,,,,,,
Caffe,Infrastructure,Infrastructure,N/A,ML Framework (Open Source),"Caffe is a deep learning framework made with expression, speed, and modularity in mind.",http://caffe.berkeleyvision.org/,FirstMark,,,,,,
Spark MLlib,Infrastructure,Infrastructure,N/A,ML Framework (Open Source),MLlib: RDD-based API,http://spark.apache.org/docs/latest/mllib-guide.html,FirstMark,,,,,,
Torch,Infrastructure,Infrastructure,N/A,ML Framework (Open Source),Torch is a scientific computing framework with wide support for machine learning algorithms that puts GPUs first.,http://torch.ch/,FirstMark,,,,,,
Chainer,Infrastructure,Infrastructure,N/A,ML Framework (Open Source),Chainer is a Python-based deep learning framework aiming at flexibility. It provides automatic differentiation APIs based on the define-by-run approach (a.k.a. dynamic computational graphs) as well as object-oriented high-level APIs to build and train neural networks.,https://chainer.org/,FirstMark,,,,,,
Horovod,Infrastructure,Infrastructure,N/A,ML Framework (Open Source),"Uber Engineering introduces Horovod, an open source framework that makes it 
faster and easier to train deep learning models with TensorFlow.",https://eng.uber.com/horovod/,FirstMark,,,,,,
PyML,Infrastructure,Infrastructure,N/A,ML Framework (Open Source),"Uber developed Michelangelo PyML to run identical copies of machine 
learning models locally in both real time experiments and large-scale 
offline prediction jobs.",https://eng.uber.com/michelangelo-pyml/,FirstMark,,,,,,
FluxML,Infrastructure,Infrastructure,N/A,ML Framework (Open Source),"Flux is an elegant approach to machine learning. It's a 100% pure-Julia stack, and provides lightweight abstractions on top of Julia's native GPU and AD support. Flux makes the easy things easy while remaining fully hackable.",https://fluxml.ai/,FirstMark,,,,,,
euler,Infrastructure,Infrastructure,N/A,ML Framework (Open Source),"A distributed graph deep learning framework. Contribute to alibaba/euler 
development by creating an account on GitHub.",https://github.com/alibaba/euler,FirstMark,,,,,,
MNN,Infrastructure,Infrastructure,N/A,ML Framework (Open Source),"MNN is a blazing fast, lightweight deep learning framework, battle-tested 
by business-critical use cases in Alibaba - GitHub - alibaba/MNN: MNN is a 
blazing fast, lightweight deep learning framework, battle-tested by 
business-critical use cases in Alibaba",https://github.com/alibaba/MNN,FirstMark,,,,,,
MMF,Infrastructure,Infrastructure,N/A,ML Framework (Open Source),"A modular framework for vision & language multimodal research from Facebook 
AI Research (FAIR) - GitHub - facebookresearch/mmf: A modular framework for 
vision & language multimodal research from Facebook AI Research (FAIR)",https://github.com/facebookresearch/mmf,FirstMark,,,,,,
