NAME,AIaaS Stack Level,Category,Industry,Sub-Category,Description,URL,Source(s),,,,,,
Yottamine,AutoML,AutoML Platform,N/A,End-to-End Automation,"Better Big Data Predictive Analytics for Marketing, Risk, Fraud, and more. 
Our parallel SVM algorithms deliver higher speed, scale, and accuracy than 
Decision Trees, Neural Networks and other machine learning techniques. It 
runs as a public or private cloud service, controlled through scripts 
written in R and Java. It is highly automated, needing no IT help or 
parameter tuning. Try it free and then pay as you go. Yottamine delivers 
the best machine learning price performance.",https://yottamine.com/,FirstMark,,,,,,
Yields,AutoML,AutoML Platform,N/A,End-to-End Automation,"Manage your model risk with greater accuracy, security, and efficiency with 
our award-winning model risk management software- The Chiron MRM Platform",https://www.yields.io/,FirstMark,,,,,,
OctoML,AutoML,AutoML Platform,N/A,End-to-End Automation,"Using ML optimization for ML deployment our Platform ingests your trained 
model, optimizes it, packages it, and lets you deploy your trained model 
anywhere.",http://www.octoml.ai,"FirstMark, Forbes50",,,,,,
Dataiku,AutoML,AutoML Platform,N/A,End-to-End Automation,"Dataiku is the world’s leading platform for Everyday AI, systemizing the 
use of data for exceptional business results.",https://www.dataiku.com/,"FirstMark, Forbes50",,,,,,
Abacus.AI,AutoML,AutoML Platform,N/A,End-to-End Automation,"Abacus.AI is the world's first end-to-end AI platform that enables 
real-time deep learning at scale for common enterprise use cases. With our 
state-of-the-art MLOps platform, you can bring your own models, or use our 
neural network techniques to create highly-accurate models, and 
operationalize them across a wide array of use cases including forecasting, 
personalization, vision, anomaly detection and NLP.",http://abacus.ai,"FirstMark, Forbes50",,,,,,
Datagran,AutoML,AutoML Platform,N/A,End-to-End Automation,"Datagran automatically runs Machine Learning on data and moves the output 
between your business applications effortlessly, so that you can focus on 
what’s important.",https://www.datagran.io/,FirstMark,,,,,,
Nextmv,AutoML,AutoML Platform,N/A,Low code,"Build, test, deploy, and operate custom decision services for any use case 
with developer-friendly tooling and workflows for modeling and solving 
operational problems.",https://www.nextmv.io/,FirstMark,,,,,,
ML Kit,AutoML,AutoML Platform,N/A,Mobile applications,Google's on-device machine learning kit for mobile developers.,https://developers.google.com/ml-kit,FirstMark,,,,,,mobility
C3.ai,AutoML,AutoML Platform,N/A,Multi-Industry,"C3 AI is a leading enterprise AI software provider for building 
enterprise-scale AI applications and accelerating digital transformation.",https://c3.ai/,FirstMark,,,,,,
Deepset,AutoML,AutoML Platform,N/A,NLP,"* Build Natural Language Interfaces for Your Data
- NLP is at the core of modern enterprise data processing. We provide developers with the right tools to build production-ready NLP systems quickly and efficiently.",www.deepset.ai,ScaleVP,AI Tool,AutoML,,,,
Human First,AutoML,AutoML Platform,N/A,NLU,"HumanFirst is data-centric tooling for NLU designers. Create, curate, 
evaluate & fine-tune long-tail NLU with 50+ NLU design superpowers. 
Transform unstructured data into highly accurate and custom labeled data to 
power your business and artificial intelligence.",humanfirst.ai,CAI,,,,,,
CoreNLP,AutoML,AutoML Platform,N/A,Open Source,"CoreNLP is your one stop shop for natural language processing in Java! CoreNLP enables users to derive linguistic annotations for text, including token and sentence boundaries, parts of speech, named entities, numeric and time values, dependency and constituency parses, coreference, sentiment, quote attributions, and relations.",https://stanfordnlp.github.io/CoreNLP/,FirstMark,,,,,,
Polyaxon,AutoML,AutoML Platform,N/A,Open Source,"Get familiar with Polyaxon - Open source machine learning on Kubernetes, 
deep Learning on Kubernetes - MLOps Lifecycle for data-scientists & 
machine-learning engineers.",https://polyaxon.com/,FirstMark,,,,,,
FATE,AutoML,AutoML Platform,N/A,"open source, security, communicty","FedAI is a community that helps businesses and organizations build AI models effectively and collaboratively, by using data in accordance with user privacy protection, data security, data confidentiality and government regulations.",https://www.fedai.org/,FirstMark,,,,,,
Vicarious,AutoML,AutoML Platform,N/A,robotics,"Bring intelligent automation to your business. Vicarious creates scalable 
robotic solutions for highly complex tasks powered by enterprise-grade AI.",http://www.vicarious.com/,FirstMark,,,,,,
Deepset AI Haystack,AutoML,AutoML Platform,N/A,Search,Haystack is an end-to-end framework that enables you to build powerful and production-ready pipelines for different search use cases,https://github.com/deepset-ai/haystack,BWGAI,,,,,,
Nuclia,AutoML,AutoML Platform,N/A,Search (Vector),"* The API to make the unsearchable, searchable.
- Build and optimized search-experience using the low-code Nuclia search engine API to get multi-language semantic results, specific paragraphs, text or relations.",nuclia.com,ScaleVP,,,,,,
Pinecone,AutoML,AutoML Platform,N/A,Search (Vector),"* Search like you mean it
- The Pinecone vector database makes it easy to build high-performance vector search applications. Developer-friendly, fully managed, and easily scalable without infrastructure hassles.",www.pinecone.io,ScaleVP,,,,,,
Zir-ai,AutoML,AutoML Platform,N/A,Search (Vector),"* The AI-powered platform for search.
- Harness the power of advanced neural networks to search your textual data with unrivaled accuracy. All with simple, scalable APIs and zero maintenance.",www.vectara.com,ScaleVP,,,,,,
Kaldi,AutoML,AutoML Platform,N/A,Speech Recgonition,"Kaldi is a toolkit for speech recognition, intended for use by speech recognition researchers and professionals.",kaldi-asr.org,CAI,,,,,,
VoiceGain,AutoML,AutoML Platform,N/A,Speech-to-text,"Voicegain helps developers build awesome voice-enabled apps by providing 
them with the most accurate, affordable, accessible Speech-to-Text platform.",voicegain.ai,CAI,,,,,,
Roboflow,AutoML,AutoML Platform,N/A,synthetic data,"With just a few dozen example images, you can train a working, 
state-of-the-art computer vision model in less than 24 hours.",https://roboflow.com/,FirstMark,,,,,,
Supervisely,AutoML,AutoML Platform,N/A,synthetic data,"Annotate images, videos, LiDAR and DICOM datasets, collaborate and train 
neural networks with world class ecosystem for AI",https://supervise.ly/,FirstMark,,,,,,
Diffgram,AutoML,AutoML Platform,N/A,,"Diffgram is a complete training data platform for machine learning 
delivered as a single application. Our Open Source platform takes care of 
Data Labeling, Workflow, Automation, Exploring, Streaming, and so much more!",https://diffgram.com/,FirstMark,,,,,,
Petuum,AutoML,AutoML Platform,N/A,,"Petuum is a composable platform that enables automatic and scalable MLOps. 
It enables deployment of machine learning models at scale. Learn more about 
it today.",http://www.petuum.com,FirstMark,,,,,,
Numenta,AutoML,AutoML Platform,N/A,,"Our algorithms, data structures and architectures help increase time to value, improve model development, accelerate training, and reduce costs and energy consumption.",http://numenta.com/,FirstMark,,,,,,
4Paradigm,AutoML,AutoML Platform,N/A,,"4Paradigm provides platform-centric artificial intelligence solutions, and uses core technologies to develop end-to-end enterprise-level artificial intelligence products, and is committed to solving the problems of efficiency, cost, and value faced by enterprises in the process of intelligent transformation, and improving enterprise decision-making Level.",http://www.4paradigm.com,FirstMark,,,,,,
SkyMind,AutoML,AutoML Platform,N/A,,Use AI for Simulation Optimization and Deploy It in Business Operations,http://www.skymind.io/,FirstMark,,,,,,
Voyager Labs,AutoML,AutoML Platform,N/A,,"Voyager Labs, a world leader in advanced AI-based investigation solutions, 
empowers organizations worldwide to gain deep investigative insights.",http://www.voyagerlabs.co,FirstMark,,,,,,
Peltarion,AutoML,AutoML Platform,N/A,,"With our AI platform, you can build your own deep learning models and 
benefit from the smart things with real-world use of artificial intelligence",https://peltarion.com/,FirstMark,,,,,,
Scaled Inference,AutoML,AutoML Platform,N/A,,Artificial Intelligence & Machine Learning Tools,https://scaledinference.com/,FirstMark,,,,,,
MetaMind,AutoML,AutoML Platform,N/A,,We help build AI Advisors.,https://www.metamind.io/,FirstMark,,,,,,
CognitiveScale,AutoML,AutoML Platform,N/A,,"CognitiveScale is a scalable and Award Winning Artificial Intelligence 
development platform and is the leader in trust, governance and transparency",https://www.cognitivescale.com/,FirstMark,,,,,,
Forefront,AutoML,AutoML Platform,N/A,,"* Powerful NLP tools a click away
- Join leading teams building the next wave of world-changing applications.
- Use pre-built solutions or large language models to quickly build NLP-enabled products and workflows.",www.forefront.ai,ScaleVP,AI Tool,AutoML,,,,
Yurts.ai,AutoML,AutoML Platform,N/A,,"* Focus on building great applications, not building models
- Yurts ai is the application development platform that makes large model architectures accesssible and affordable",www.yurts.ai,"ScaleVP, BWGAI",AI Tool,Automl,,,,
CohereAI,AutoML,AutoML Platform,N/A,,"Cohere provides access to advanced Large Language Models and NLP tools 
through one easy-to-use API. Get started for free.",https://cohere.ai/,FirstMark,,,,,,
Mantium,AutoML,AutoML Platform,N/A,,"* Build AI applications in minutes and manage them at scale.
- Use state of the art language models to build AI applications and automations, and manage them in our low-code cloud platform.",www.mantiumai.com,ScaleVP,,,,,,
Skydio,AutoML,Data Analytics for Business Decisions,N/A,Autonomous Vehicles,"Skydio Autonomous Drones for business, public safety and creative endeavors.",http://skydio.com,FirstMark,,,,,,
Third Wave Automation,AutoML,Data Analytics for Business Decisions,N/A,Autonomous Vehicles,"Third Wave Automation’s Collaborative Autonomy Platform™ combines hybrid 
autonomous vehicles and intelligent fleet management to provide materials 
handling solutions that improve over time.",https://www.thirdwave.ai/,FirstMark,,,,,,
Information Builders,AutoML,Data Analytics for Business Decisions,N/A,BI Platforms,"A full stack data management and business intelligence solution provides 
trusted and business-ready data, for all users and for all use cases.",https://www.informationbuilders.com/,FirstMark,,,,,,
GoodData,AutoML,Data Analytics for Business Decisions,N/A,BI Platforms,"GoodData is a BI and data analytics platform built to create real-time 
dashboards and low-code/no-code analytics applications with open APIs.",http://www.gooddata.com/,FirstMark,,,,,,
Kyvos Insights,AutoML,Data Analytics for Business Decisions,N/A,BI Platforms,"Kyvos Cloud BI Acceleration Platform helps you transform your business with 
faster & deeper insights, lets you analyze all your data using your 
existing BI tool while optimizing resource consumption & reducing cloud 
costs.",http://www.kyvosinsights.com/,FirstMark,,,,,,
Qlik,AutoML,Data Analytics for Business Decisions,N/A,BI Platforms,"Qlik closes the gaps between data, insights and action with the only cloud platform built for Active Intelligence.",http://www.qlik.com/,FirstMark,,,,,,
Amazon QuickSight,AutoML,Data Analytics for Business Decisions,N/A,BI Platforms,"Amazon QuickSight is a cloud-native, serverless, business intelligence with 
native ML integrations and usage-based pricing, allowing insights for all 
users.",https://aws.amazon.com/quicksight/,FirstMark,,,,,,
Domo,AutoML,Data Analytics for Business Decisions,N/A,BI Platforms,"Domo is where integration, BI & analytics, and data apps come together to 
power everyday work.",https://www.domo.com/,FirstMark,,,,,,
Jaspersoft,AutoML,Data Analytics for Business Decisions,N/A,BI Platforms,"TIBCO Jaspersoft embedded analytics software is the most flexible, 
customizable, and developer-friendly BI platform in the world. Design, 
embed, and manage reports & analytics with programmatic control.",https://www.jaspersoft.com/,FirstMark,,,,,,
Lightdash,AutoML,Data Analytics for Business Decisions,N/A,BI Platforms,"Instantly turn your dbt project into a full-stack BI platform. Analysts 
write metrics and Lightdash enables self-serve for the entire business.",https://www.lightdash.com/,FirstMark,,,,,,
Microstrategy,AutoML,Data Analytics for Business Decisions,N/A,BI Platforms,"MicroStrategy is the enterprise analytics platform built for disruption. We 
focus on elevated data experiences that fuel innovation across all 
organizations.",https://www.microstrategy.com/us,FirstMark,,,,,,
Caserta Concepts,AutoML,Data Analytics for Business Decisions,N/A,Constultancy,"Data and analytics consulting to help create a working data strategy, and 
modern data architecture to exceed your business goals.",http://casertaconcepts.com/,FirstMark,,,,,,
Valiance Solutions,AutoML,Data Analytics for Business Decisions,N/A,Constultancy,"Valiance is a leading AI & Data analytics solutions provider using cutting 
edge ML algorithms, Data engineering & Cloud technology.",http://valiancesolutions.com/,FirstMark,,,,,,
DataKind,AutoML,Data Analytics for Business Decisions,N/A,Constultancy,Harnessing the power of data science + AI in the service of humanity,http://www.datakind.org/,FirstMark,,,,,,
EXL Analytics,AutoML,Data Analytics for Business Decisions,N/A,Constultancy,"EXL offers the domain-specific advanced analytics and AI solutions you need 
to make better, faster decisions in today’s millisecond economy.",http://www.exlservice.com/analytics/,FirstMark,,,,,,
Fast Forward Labs,AutoML,Data Analytics for Business Decisions,N/A,Constultancy,Cloudera Fast Forward Labs Research accelerates your data and machine learning initiatives with a research subscription and working prototypes.,http://www.fastforwardlabs.com/,FirstMark,,,,,,
Mu Sigma,AutoML,Data Analytics for Business Decisions,N/A,Constultancy,"Explore MuSigma, a category defining data analytics firm providing big data 
services, decision sciences and helping enterprises in data-driven decision 
making.",http://www.mu-sigma.com/,FirstMark,,,,,,
Via Science,AutoML,Data Analytics for Business Decisions,N/A,Constultancy,"Communities are cleaner, safer, and more equitable when they Solve with VIA.",http://www.viascience.com/,FirstMark,,,,,,
Electrifai,AutoML,Data Analytics for Business Decisions,N/A,Constultancy,"Drive Revenue, Reduce Cost, Mitigate Risks Through Machine Learning.",https://electrifai.net/,FirstMark,,,,,,
Think Big Analytics,AutoML,Data Analytics for Business Decisions,N/A,Constultancy,Think Big. Think Big Analytics is a global business analytics consultancy. We help companies achieve high-impact outcomes buy giving them straig...,https://thinkbiganalytics.com/,FirstMark,,,,,,
Accenture,AutoML,Data Analytics for Business Decisions,N/A,Constultancy,Total Enterprise Reinvention,https://www.accenture.com/,FirstMark,,,,,,
Booz,AutoML,Data Analytics for Business Decisions,N/A,Constultancy,"We develop solutions that pair our best-in-class data scientists with 
emerging technologies.",https://www.boozallen.com/expertise/analytics.html,FirstMark,,,,,,
Alteryx,AutoML,Data Analytics for Business Decisions,N/A,Data Analyst Platforms,"The Alteryx Analytics Automation Platform delivers end-to-end automation of 
analytics, machine learning, and data science processes that accelerate 
digital transformation.",http://www.alteryx.com/,FirstMark,,,,,,
Pentaho,AutoML,Data Analytics for Business Decisions,N/A,Data Analyst Platforms,"Data integration and analytics platform powered by Pentaho to manage data 
at scale for rapid business innovation, ease of use, and self-service 
automation and orchestration.",http://www.pentaho.com/,FirstMark,,,,,,
Einblick,AutoML,Data Analytics for Business Decisions,N/A,Data Analyst Platforms,"Einblick is the fastest and most collaborative way to explore data, create 
predictions, and deploy data apps.",https://einblick.ai/,FirstMark,,,,,,
Kleene.ai,AutoML,Data Analytics for Business Decisions,N/A,Data Analyst Platforms,"We combine all data sources in one place, translate them into one language 
and organize everything to make it easier for teams to work with.",https://kleene.ai/,FirstMark,,,,,,
Precog,AutoML,Data Analytics for Business Decisions,N/A,Data Analyst Platforms,"Precog’s universal data integration (ELT) solution makes it easy to get the 
data in your 3rd-party apps into your BI, ML, and custom applications",https://precog.com/,FirstMark,,,,,,
Switchboard,AutoML,Data Analytics for Business Decisions,N/A,Data Analyst Platforms,"Aggregate disparate data at scale, reliably and in real-time, to make 
better business decisions with Switchboard - a data engineering automation 
platform used by market-leading digital companies.",https://switchboard-software.com/,FirstMark,,,,,,
y42,AutoML,Data Analytics for Business Decisions,N/A,Data Analyst Platforms,"Y42 is the first fully managed Modern DataOps Cloud for production-ready 
data pipelines on top of Google BigQuery and Snowflake.",https://www.y42.com/,FirstMark,,,,,,
Atlan,AutoML,Data Analytics for Business Decisions,N/A,Data Catalog & Discovery (Analytics),"Atlan is an active metadata platform for modern data teams, that helps them 
discover, understand, trust, and collaborate on data assets.",http://atlan.com,FirstMark,,,,,,
Metaphor Data,AutoML,Data Analytics for Business Decisions,N/A,Data Catalog & Discovery (Analytics),"Making Data Actionable, At Scale - Designed for data teams building 
cloud-native, self-service data platforms for their business users",http://metaphor.io,FirstMark,,,,,,
Secoda,AutoML,Data Analytics for Business Decisions,N/A,Data Catalog & Discovery (Analytics),"Level up your data stack with Secoda, the modern data catalog and lineage 
portal built for data teams. Discover and document all of your metadata in 
one place.",http://secoda.co,FirstMark,,,,,,
SelectStar,AutoML,Data Analytics for Business Decisions,N/A,Data Catalog & Discovery (Analytics),"Select Star, data management platform that helps to browse data catalogs to 
find, organize, maintain and understand your data. Sign up for a FREE trial.",http://selectstar.com,FirstMark,,,,,,
Stemma,AutoML,Data Analytics for Business Decisions,N/A,Data Catalog & Discovery (Analytics),"Stemma is a fully managed data catalog, powered by the leading open-source 
data catalog, Amundsen",http://stemma.ai,FirstMark,,,,,,
data.world,AutoML,Data Analytics for Business Decisions,N/A,Data Catalog & Discovery (Analytics),"data.world's cloud-native data catalog makes it easy for everyone—not just 
the ""data people""—to get clear, accurate, fast answers to any business 
question.",http://www.data.world,FirstMark,,,,,,
Zeenea,AutoML,Data Analytics for Business Decisions,N/A,Data Catalog & Discovery (Analytics),"With our data discovery platform, provide a next-generation workspace for 
your data teams to find, understand and collaborate on your data.",http://zeenea.com,FirstMark,,,,,,
Snowboard Software,AutoML,Data Analytics for Business Decisions,N/A,Data Catalog & Discovery (Analytics),"The workspace for analytics, at scale. Data Catalog 🔎, Data Observability 
🚨 and Metric Store 📈",https://www.snowboard.software/,FirstMark,,,,,,
Primer,AutoML,Data Analytics for Business Decisions,N/A,"Government & Intelligence, Vertical","At Primer, we help organizations make the best use of their investment in 
data, by using best-in-class machine learning and natural language 
processing technologies. ""* Primer lets organizations quickly explore and utilize the world’s exponentially growing sources of text-based information. 
- Our best-in-class machine intelligence solutions help you answer complex questions in real time with human-level precision.""",https://primer.ai/,"FirstMark, ScaleVP",,,,,,
CloudMinds,AutoML,Data Analytics for Business Decisions,N/A,Industrial (Robotics),"CloudMinds is a cloud intelligent robot operator. CloudMinds is providing professional robot operation services for customers in various industries. It has launched welcome robots using cloud intelligence, security patrol robots, indoor cleaning robots, and smart retail robots. Virtual explanation robot and other service robot solutions",http://cloudminds.com,FirstMark,,,,,,
Inspirient,AutoML,Data Analytics for Business Decisions,N/A,Large Scale Solutions,"Discover new insights in your business data more efficiently than ever 
before, with Inspirient’s autonomous analytics platform!",https://www.inspirient.com/,FirstMark,,,,,,
Macheye,AutoML,Data Analytics for Business Decisions,N/A,Large Scale Solutions,"MachEye empowers decision intelligence for digital enterprises with what, 
why, and how of data. Make your data consumable and actionable. Get started 
now!",https://www.macheye.com/,FirstMark,,,,,,
Luminoso,AutoML,Data Analytics for Business Decisions,N/A,Large Scale Solutions,"Natural language understanding for text analytics for insights 
professionals - across any industry & all technical levels. Request a demo 
of our best-in-class text analytics platform today.",http://luminoso.com/,FirstMark,,,,,,
Attivio,AutoML,Data Analytics for Business Decisions,N/A,Large Scale Solutions,"Attivio provides industry-leading natural language processing, machine 
learning, text analytics, and AI-powered search capabilities at scale.",http://www.attivio.com/,FirstMark,,,,,,
maya,AutoML,Data Analytics for Business Decisions,N/A,Large Scale Solutions,A market intelligence engine that combines business with external data to develop faster and more accurate decisions.,https://meetmaya.world/,FirstMark,,,,,,
Quid,AutoML,Data Analytics for Business Decisions,N/A,Large Scale Solutions,"NetBase Quid delivers AI-powered consumer and market intelligence to enable 
business reinvention in a noisy and unpredictable world.",https://quid.com/,FirstMark,,,,,,
Dataminr,AutoML,Data Analytics for Business Decisions,N/A,Large Scale Solutions,"Customers rely on Dataminr’s AI platform for early signals of high-impact events and emerging risks, to respond with confidence and manage crises more effectively",https://www.dataminr.com/,FirstMark,,,,,,
FiscalNote,AutoML,Data Analytics for Business Decisions,N/A,Large Scale Solutions,"The #1 most trusted partner for managing the global issues and policy 
affairs that present the biggest risks and opportunities to your 
organization.",https://www.fiscalnote.com/,FirstMark,,,,,,
Forge.AI,AutoML,Data Analytics for Business Decisions,N/A,Large Scale Solutions,"Unstructured data transformed into computational fuel that accelerates analytics, decision making & predictive modeling.",https://www.forge.ai/,FirstMark,,,,,,
OpenDataSoft,AutoML,Data Analytics for Business Decisions,N/A,Large Scale Solutions,"The all-in-one platform that empowers your whole team to accelerate wider 
data usage and generate value in your ecosystems.",https://www.opendatasoft.com/,FirstMark,,,,,,
Palantir,AutoML,Data Analytics for Business Decisions,N/A,Large Scale Solutions,"We build software that empowers organizations to effectively integrate 
their data, decisions, and operations.",https://www.palantir.com/,FirstMark,,,,,,
Augury,AutoML,Data Analytics for Business Decisions,N/A,Large Scale Solutions,"Augury's end-to-end solutions provide industry leaders with early, 
actionable and comprehensive insights into machine health and performance.",http://www.augury.com/,FirstMark,,,,,,
KONUX,AutoML,Data Analytics for Business Decisions,N/A,Large Scale Solutions,"KONUX combines Machine Learning algorithms and IoT to deliver 
software-as-a-service solutions for operation, monitoring, and maintenance 
process automation",http://www.konux.com,FirstMark,,,,,,
Sight Machine,AutoML,Data Analytics for Business Decisions,N/A,Large Scale Solutions,"A Single Data Foundation for Operations and Analysis. Continuously 
transform and analyzes all plant data so that you can focus on improving 
production.",http://www.sightmachine.com/,FirstMark,,,,,,
Tachyus,AutoML,Data Analytics for Business Decisions,N/A,Large Scale Solutions,Accelerating Digital Transformation for Energy Sustainability,http://www.tachyus.com/,FirstMark,,,,,,
Altana,AutoML,Data Analytics for Business Decisions,N/A,Large Scale Solutions,"Altana AI enables trusted commerce by providing the single source of truth 
on the global supply chain.",https://altana.ai/,FirstMark,,,,,,
CloudNC,AutoML,Data Analytics for Business Decisions,N/A,Large Scale Solutions,"CloudNC develops advanced software that enables companies to create 
efficient and reliable manufacturing processes in a single click.",https://cloudnc.com/,FirstMark,,,,,,
Cognitops,AutoML,Data Analytics for Business Decisions,N/A,Large Scale Solutions,"CognitOps helps supply chain leaders & operators better manage their 
buildings so they can make the best decisions, at the right time. Every 
time.",https://cognitops.com/,FirstMark,,,,,,
AVEVA,AutoML,Data Analytics for Business Decisions,N/A,Large Scale Solutions,"At AVEVA, we work with you and harness the power of our ecosystem, to 
deliver solutions and expertise to optimize engineering, operations and 
performance.",https://www.aveva.com/,FirstMark,,,,,,
Doxel,AutoML,Data Analytics for Business Decisions,N/A,Large Scale Solutions,"Continuous performance monitoring and predictive insights to stay one step 
ahead of delays and cost overruns.",https://www.doxel.ai/,FirstMark,,,,,,
